카테고리,제목,주최,조회수,D-day,접수기간,팀원 모집,댓글 수,포스터,상세 링크,상세 내용
서포터즈,[만수종합사회복지관] 대학생 나눔이 서포터즈 모집 (~2/28),만수종합사회복지관,331,D-7,1월 20일(월) ~ 2월 28일(금),0,0,https://cf-cpi.campuspick.com/activity/174001561344517.jpg,https://www.campuspick.com/activity/view?id=27699,"마을의 가치를 전하는 대학생 전문 자원봉사단 모집 「나눔이 홍보 서포터즈」  ‘나눔이 홍보 서포터즈’는 열정이 가득한 대학생으로 이루어진 전문 봉사단으로 디지털 매체를 활용한 맞춤형 홍보 전략을 기획하여 긍정적인 지역사회변화를 리드하는 대학생 자원봉사단입니다.  - 대학 생활을 알차게 보내고 싶다면? - 열정 넘치는 친구들을 만나고 싶다면? - 사회복지 현장을 경험하고, 역량을 강화하고 싶다면?  만수복지관의 나눔이 홍보 서포터즈에 신청하세요 :)   ○ 모집기간 ★-모집기간: 2025년 1월 20일(월) ~ 2월 21일(금) 18시 마감★ * 서류전형 심사 후, 전화면접 예정 (개별 문자안내) - 합격자 발표: 2월 28일(금) 복지관 홈페이지 및 개별안내  ○ 신청방법 [복지관 홈페이지]-[프로그램안내]-[나눔이서포터즈] 신청서 작성 후 이메일 지원 (mansooy@hanmail.net)  ○ 지원 자격 - 인천 남동구에서 활동이 가능한 대학교 재/휴학생 - 해당 요일에 활동이 가능하신 분 (1·3째주 금요일) - 홍보사회사업에 관심이 있는 분 - 1년 활동에 책임감을 갖고 참여할 수 있는 분  ○ 활동 내용 - 전문 봉사단 프로그램 (오리엔테이션, 간담회, 평가회 등) - SNS 홍보 전략 기획 및 콘텐츠 제작 (촬영부·편집부 - 영상제작 역량강화 교육) - 마을 나눔활동 (기관 축제, 캠페인, 아동 놀이 프로그램 봉사) - 기타 (창의 봉사 활동 진행 등)  ○ 혜택 내역 - 전문봉사활동의 기회 제공 - VMS 실적 인증 - 수료증 발급 - 영상제작 역량강화 교육  ○ 활동 기간 - 홍보사회사업 : 2025년 4월 ~ 11월 (1·3째주 금요일 / 월 2회) -오리엔테이션 : 합격자 발표 후 3월 중 -마을 나눔활동 : 기관 일정 상이 (7~9월 예정 / 자발적 참여)  ○ 활동 장소 - 인천광역시 남동구 담방로 105 만수종합사회복지관 및 인근  ○ 문의 070-4365-4320 방지혁 사회복지사"
서포터즈,2025년 ????포토미디어동아리 [뷰파인더] 신규 단원 모집 안내,시립은평청소년센터,450,D-7,1월 14일(화) ~ 2월 28일(금),0,0,https://cf-cpi.campuspick.com/activity/1737332589076332.jpg,https://www.campuspick.com/activity/view?id=27696,정보 없음
서포터즈,2025년 시립노원청소년센터 청소년 동아리 모집?????,시립노원청소년센터,293,D-7,1월 16일(목) ~ 2월 28일(금),0,0,https://cf-cpi.campuspick.com/activity/1737006088233611.jpg,https://www.campuspick.com/activity/view?id=27673,"2025년 재미있고 의미있는 경험을 해보고 싶다면? 바로 주목해주세요!!!??  ""나는 가장 빛나는 이야기다""의 애칭을 가진 나다센터에서 올해 함께 빛나는 이야기를 써내려갈 청소년 동아리를 모집합니다.????  댄스, 랩, 보컬, 밴드 등 공연동아리 및 공연 외 다양한 분야의 비공연 동아리 모집과 더불어 지역사회를 변화시키기 위해 직접 봉사 프로젝트를 만들고 운영하는 자기주도형 봉사 동아리도 모집하고 있습니다!  여러분들의 불타는 열정을 나다센터에서 보여주세요!! 많은 신청과 관심 부탁드립니다????  ? 청소년 동아리  - 공연동아리 & 비공연동아리 신청링크: https://forms.gle/EztwTz4ZaUcxSsdC6  - 자기주도형 봉사동아리 신청링크: https://forms.gle/qaS3q1yDJSe9HLVg8  ? 모집안내 - 신청기간 : ~ 2025년 2월 28일(금) / 선착순 마감 예정(빠르게 신청할수록 선정확률 up!) - 신청방법 : 신청서 작성 후 제출 - 2차 면담 일정협의 및 면담 진행 - 최종선정 - 신청문의 : 동아리(공연, 비공연) 02-950-3172 / 자기주도형 봉사동아리 02-950-3173"
서포터즈,서울시립은평청소년센터 대학생기획단 4기 신규모집,서울시립은평청소년센터,499,D-7,1월 16일(목) ~ 2월 28일(금),0,0,https://cf-cpi.campuspick.com/activity/1736989767282222.jpg,https://www.campuspick.com/activity/view?id=27666,정보 없음
서포터즈,"금천구 청년도전지원사업 참여자 모집 (졸업생만 가능, ~3/7)",고용노동부,300,D-14,1월 15일(수) ~ 3월 7일(금),0,0,https://cf-cpi.campuspick.com/activity/1737077290825246.jpg,https://www.campuspick.com/activity/view?id=27662,"도전대학과 함께라면 의미 없는 도전은 없다!??  ??다양한 맞춤형 프로그램을 들을 수 있는 기회 ??프로그램 이수하고 최대 350만원 수당 받을 기회  작년에 이어 고용노동부의 청년도전지원사업이 도전대학으로 여러분을 찾아왔습니다.  ??참여 대상자 ??창업을 준비하지만 망설이고 있으신 분, ??정확히 하고 싶은 일은 모르겠지만 일을 하고 싶으신 분, ??알바를 하고 있지만 이제는 안정된 직장을 찾고 싶으신 분, ??여러가지 이유로 취업이 미뤄졌거나 잠시 일을 쉬고 계신 분, ??사람들을 만나 다양한 프로그램을 하면서 리프레시 하고 싶으신 분  ??프로그램 살짝 엿보기 ?? 밀착상담 : 1:1 맞춤 개별 상담과 집단상담 프로그램을 통해 각자가 가진 고민을 허심탄회하게 풀어내고, 내 인생의 타임라인 작성까지!?? ?? 사례관리 : 유익한 정보들만 가득! 부동산 정책 및 경제지식 강의?? ?? 자신감회복 : 가죽카드지갑 공예, 컬러테라피 등 힐링 타임?? ?? 진로탐색 : 버크만, 태니지먼트 등 다양한 적성검사??와 대기업 현직자 멘토링으로 완벽한 진로탐색 ? ?? 취업역량강화 : 면접준비를 위한 퍼스널컬러, 체형코디??와 실무 연습을 위한 엑셀, PPT 강의?????까지!  이외에도 초특급 프로그램이 가득!  각 과정에 맞춰 40시간 혹은 200시간 이상 프로그램 이수 시 ?? 5회 출석 당 → 50만원?? 수당 지급!   ??참여 유형 ??단기: 20명 (2/12 ~ 3/12, 매주 수요일 5주간 진행 예정) *총 수당 50만원 ??장기: 35명 (3/20 ~ 9/4, 매주 목요일 25주간 진행 예정) *총 수당 350만원 *기관 사정 상 일정이 변동 될 수 있습니다.  ??신청 방법 https://forms.gle/JdEqteuqfLHrqHLy7 https://m.site.naver.com/1AnHr  ??신청기간 ??단기 : ~ 2025년 1월 31일(화) ??장기 : ~ 2025년 3월 7일(금) ※ 인원 모집 충족 시, 조기 마감될 수 있습니다.  ??문의 ?? 010-4377-0597(청년도전팀)"
서포터즈,2025 시립망우청소년센터 대학생 자치조직 신규 단원 모집,시립망우청소년센터,219,D-14,1월 7일(화) ~ 3월 7일(금),0,0,https://cf-cpi.campuspick.com/activity/1736835772168768.jpg,https://www.campuspick.com/activity/view?id=27642,"? 시립망우청소년센터 대학생 자치조직 신규 단원 모집 ?  망우와 함께하고 싶은 대학생! 여기 붙어라 ???? 모두 모여라 ????  시립망우청소년센터에서 다양한 활동에 참여하며 즐거운 추억을 쌓아갈 대학생 친구들을 모집합니다!  다양한 연령대의 청소년들과 소통하며 색다른 경험을 해보고 싶다면?! 망우청소년센터의 애정 넘치는 관심과 지원을 받으며, 다양한 경험을 통해 성장하고 싶다면?! 지금 바로 망우청소년센터 자치조직에 신청하세요!!  ?? 모집 기간 : ~2025. 3. 7.(금)까지 ?? 모집 대상 : ~24세 청소년이라면 누구나! ?? 신청 방법 : 구글 폼 신청 큐알코드 또는 링크(https://forms.gle/6Nax1W5uYZ3FVP427) ?? 신청 폼 접수 후 대면 면접을 통해 선발 예정  ?? 청소년운영위원회와 함께 할 사람 여기 모여라! 청소년센터의 꽃은 청운위! 청소년을 위한 축제, 시설 등 청소년센터의 모든 활동을 모니터링하고 기획해 보고싶다면? 여기로 오세요!  ?? 대학생서포터즈단 M버서더와 함께 할 사람 여기 모여라! 우리가 바로 청소년을 지도하는 미래의 청소년지도사, 청소년에 대해 더 알고 싶고 미래에 청소년과 관련된 진로를 생각한다면 바로 신청해!  ?? 청소년미디어 동아리와 함께 할 사람 여기 모여라! HOT한 신규 동아리! 미디어 교육을 통해 유튜브 및 SNS에 자신만의 미디어 작품을 홍보해 보고 싶다면 여기가 바로 그곳!  ?? 메이커동아리 메이커CREW 5기와 함께 할 사람 여기 모여라! 미래의 공학도 또는 현재 나는 천재 공학도라고 생각하는 청소년 모두 여기로 모엿! 너의 공학 유전자를 여기서 펼쳐라  ? 망고맛과 함께 할 사람 여기 모여라! 망고맛과 함께라면 프로 카페메뉴 개발러 가능! 2023년 서울시청소년동아리활동지원사업 우수 활동 동아리에 뽑힌 동아리랍니다!  자치조직별 문의사항은 포스터에 기재된 담당자 번호나 아래 번호로 편하게 연락주세요! ?? 02-6919-3313 청소년활동팀 박다솜"
서포터즈,"2025 기아챌린지 대학생 교육봉사단 ""Key-서포터즈 11기' 모집",기아AutoLand광명 X 광명시사회복지협의회,"4,654",D-4,2월 18일(화) ~ 2월 25일(화),0,0,https://cf-cpi.campuspick.com/activity/1739862144716798.jpg,https://www.campuspick.com/activity/view?id=27631,"기아챌린지 Key-아카데미는 광명시사회복지협의회가 기아 AutoLand 광명의 지원을 받아 함께 운영하는 청소년 방과후 공부방으로 청소년들에게 교육과 다양한 문화활동 제공을 통해 학습능력 향상과 정서지원에 도움을 주고 있습니다.  ○ 주최사 / 활동명 * 기아Autoland광명 X 광명시사회복지협의회 2025 기아챌린지 대학생 교육봉사단 ""Key-서포터즈 11기  ○ 활동내용 * 초등 6학년 ~ 중등 2학년 수학, 영어 학습 멘토링 (전문강사 수업 이후 보충학습 멘토링 진행)  ○ 모집 기간 * 2025년 2월 18일(화) ~ 2/25(화)까지 추가 모집 중 * 2/26(수) 면접 진행 후 2/27(목) OT&발대식 진행  ○ 모집 인원 * 총 20명 내외  ○ 모집 대상(+졸업생 가능여부) * 1년 동안 활동이 가능한 대학(원)생 및 휴학생 (졸업생 불가)  ○ 참가 비용 유/무 * 참가비용 무  ○ 우대 사항 * 광명 근거리 거주자, 교육 봉사 및 멘토링 경험자, 청소년을 좋아하고 따뜻하게 바라봐주는 누구나 가능!  ○ 활동 지역 * Key-아카데미 (경기도 광명시 기아로 34, 기아 국내생산통합오피스 건물 4층)  ○ 활동 기간 * 2025년 3월 4일(화) ~ 2026년 2월 말  ○ 활동 혜택 * 우수활동자 표창 및 소정의 장학금 지급 * 기아Autoland광명 임직원 멘토링 * 교육 및 간담회 지원 * 서포터즈 유니폼 제공 * VMS 활동시간 인증 * 워크샵 지원 * 활동수료증 발급  ○ 오프라인 모임 횟 수 (월 x회) * 주 1회(월~목 중 하루 / 17:00~19:00)  ○ 지원 방법 * 광명시사회복지협의회(www.gmcsw.kr) 홈페이지 접속 → Key-아카데미 사업 '참여신청' → '서포터즈 신청'에서 신청서(자기소개서 및 경력기술) 작성 후 제출하기  ○ 공식 카페/블로그 및 SNS * www.gmcsw.kr  ○ 문의처 * 광명시사회복지협의회 070-5088-1968 / 02-2687-1091 (통화가능시간 10시~18시)"
서포터즈,2025. 청년 서포터즈 『이음』 단원 모집,성남시청소년재단 분당서현청소년수련관,"6,438",D-7,2024년 12월 12일(목) ~ 2월 28일(금),0,1,https://cf-cpi.campuspick.com/activity/1733896618799557.jpg,https://www.campuspick.com/activity/view?id=27408,"성남시청소년재단 분당서현청소년수련관 청년 서포터즈 『이음』단원을 모집합니다. 활동 중 식사 및 봉사활동 시간을 제공하며, 다양한 공모전의 참여기회를 제공합니다! 주로 분당서현청소년수련관 내에서 활동을 진행하며, 만19세~만34세 청년 누구나 신청가능합니다! 홍보 포스터의 QR코드를 통해 신청 가능하니 많은 신청바랍니다."
서포터즈,[공공기관] 2025년 청소년 창업동아리 틴틴메이커 멘토 모집,서초구립 방배유스센터,"3,876",D-5,2월 6일(목) ~ 2월 26일(수),0,5,https://cf-cpi.campuspick.com/activity/1738830270875889.jpg,https://www.campuspick.com/activity/view?id=24659,"안녕하세요~ 방배유스센터 [틴틴메이커]에서 멘토를 모집합니다!  청소년들과 함께 온오프라인 굿즈 기획, 제작 활동을 해보고 싶으신 분! 청소년들을 대상으로 일러스트나 포토샵, 마케팅 멘토링 활동을 하고 싶으신 분! 청소년들의 꿈과 끼를 함께 펼쳐주실 분!  청소년들과 즐겁게 활동을 해나갈 멘토를 모집합니다 'ㅡ'  [틴틴메이커 멘토 모집]  - 모집 대상 : 20~29세 청소년을 사랑하는 청년 누구나 - 모집 기간 : 2025.02.24(월) 자정까지 - 면접 일자 : 2025.03.08(토) 면접 진행 - 우대 사항 : 청소년 관련 활동 유경험자, 포토샵&일러스트 활용 경험자, 경영 등 관련학과 재학생 - 문의 사항 : 070-4858-1826 (화~토 9:00-18:00 통화 가능) 또는 방배유스센터 예술사업팀 오픈채팅방 - 신청 방법 : 구글폼으로 신청 https://forms.gle/QvUcvnoUPgePDVxK8  *틴틴메이커 활동은 매주 토요일 14:00~16:00까지 입니다. / 시험 기간 제외"
서포터즈,축제&행사 기획에 관심있는 대학생 주목! 축제기획단 모집(~2/28),방배아트유스센터,"5,312",D-7,2월 15일(토) ~ 2월 28일(금),0,0,https://cf-cpi.campuspick.com/activity/1739600999881977.jpg,https://www.campuspick.com/activity/view?id=24612,정보 없음
서포터즈,2025년 시립보라매청소년센터 4차산업 재능기부단 SAY 활동 청소년 모,시립보라매청소년센터,9,정보 없음,2월 19일(수) ~ 3월 8일(토),0,0,https://cf-cpi.campuspick.com/activity/1739946562745628.jpg,https://www.campuspick.com/activity/view?id=28052,정보 없음
서포터즈,2025년 자살예방 홍보·기획단 '생명사랑 알리미' 신규 모집,시립보라매청소년센터,14,정보 없음,2월 9일(일) ~ 3월 31일(월),0,0,https://cf-cpi.campuspick.com/activity/1739839132158277.jpg,https://www.campuspick.com/activity/view?id=28047,"?? 주최사: 시립보라매청소년센터 소속 생명사랑팀 - 시립보라매청소년센터 생명사랑팀이란? : 사회활동 진행 시에 심리적 어려움이 있는 청소년들을 대상으로 개인상담 및 집단상담 프로그램 지원과 더불어 학교와 연계하여 또래상담자 양성 교육 지원 프로그램을 제공하는 기관  ?? 활동명: 생명존중, 자살예방 캠페인 기획 및 홍보단 '생명사랑 알리미'  ?? 활동개요 - 활동 기간: 2025년 3월~ 12월(시험기간 제외) - 활동 시수: 월 2~3회 정기회의 및 활동 진행 - 활동 장소: 시립보라매청소년센터 슬기동 2층, 생명사랑센터 및 온라인 화상회의 (주소: 서울 동작구 여의대방로 20길 61, 슬기동 2층) - 활동 내용 1) 부스 및 상담 관련 프로그램 기획 교육 및 프로그램 진행 간 활동수칙 안내 2) 푸어링 아트, 백드롭 페인팅, 보석 십자수 등 캠페인 진행 기자재 활용 교육 진행 3) 생명존중, 자살예방 프로그램 및 부스 기획 및 진행 4) 센터 내부 축제 및 지역사회 연계 축제 부스 운영 5) 시립보라매청소년센터 내부 연합 인준식 및 송년잔치 참여(청소년 교류 활동)  ?? 모집 기간 - 상시모집(선착순 모집으로 진행되며 신청자 10명 달성 시 마감) - 모집 대상 1) 14~24세 청소년 10명 2) 청소년 상담사 및 심리 관련 진로를 희망하는 청소년! 3) 청소년, 상담 사범 관련 전공을 하고 있는 대학생! * 특별한 자격 조건 없이 연령대만 일치한다면 환영합니다~  ?? 우대 사항 - 생명사랑팀에서 진행하는 다양한 미술 공예 프로그램 및 심리검사 제공 - 연중 활동 비용 및 간식비 지원 - 자원봉사시간 입력(축제 부스 및 재능기부 프로그램 운영 시) - 활동우수청소년 표창(보라매센터장상) 수여: 성실히 참여한 청소년 대상으로 기회 부여  ?? 지원 방법 - 구글 폼 신청서 작성(https://forms.gle/AmJaMp5eEiFhFXPM9) - 신청 문의: 생명사랑팀 원소영 02-834-1343 - 문의 가능 시간: 화-토 9:00~18:00 (일,월은 센터 휴관일이므로 전화 응대가 불가합니다)"
서포터즈,-대학생 국제교류 서포터즈- 수원시 공공외교단(SCVA) 12기 모집,수원시국제교류센터,26,정보 없음,2월 19일(수) ~ 3월 16일(일),0,0,https://cf-cpi.campuspick.com/activity/1739941466541682.jpg,https://www.campuspick.com/activity/view?id=28040,정보 없음
서포터즈,청년 커뮤니티 기반 지역문제 해결 프로젝트 기획봉사단 “슬기로운 청년생활,삼산종합사회복지관,11,정보 없음,2월 18일(화) ~ 3월 14일(금),0,0,https://cf-cpi.campuspick.com/activity/1739865291332666.jpg,https://www.campuspick.com/activity/view?id=28033,"청년 커뮤니티 기반 지역문제 해결 프로젝트 기획봉사단 “슬기로운 청년생활” 참여자 모집  안녕하세요. 인천 부평구 삼산동에 위치하고 있는 삼산종합사회복지관입니다.  삼산복지관에서는 청년 커뮤니티를 기반으로 지역문제 해결역량을 키울 수 있는 청년 프로젝트 기획봉사단의 참여자를 모집합니다.  또래 청년들과 재미있게 의미있는 활동을 하고싶어 하는 청년들의 많은 참여 바랍니다. (봉사시간, 활동 수료증, 우수참여자 시상 등 제공)  참여자들이 가장 많이 모일 수 있는 시간대로 활동 요일 및 시간은 변동 될 수 있으며 활동시간대에 대해 의견 수렴을 받고 있습니다! ^^  * 참여신청 및 문의 1. 홍보물 속에 있는 큐알스캔 후 신청 2. 링크눌러 신청 https://naver.me/FeX3k9sg 3. 010-7232-8607 문자로 신청 4. 032-529-8607 전화로 신청  #삼산복지관 #청년봉사단 #청년 #20대 #30대 #커뮤니티 #친구 #봉사 #자원봉사 #봉사활동 #봉사시간 #봉사활동추천 #보람 #서포터즈 #대외활동 #기획단 #프로젝트 #사회복지 #베리어프리 #수료증 #정책제안 #개선활동 #성장 #스펙"
서포터즈,2025년 기아프렌토링 희망꿈틀멘토링 대학생 멘토 모집,반포종합사회복지관,39,정보 없음,2월 17일(월) ~ 3월 31일(월),0,0,https://cf-cpi.campuspick.com/activity/1739788334691848.jpg,https://www.campuspick.com/activity/view?id=28018,"희망꿈틀멘토링은, '희망과 꿈을 담은 틀'이라는 뜻으로, 서초구 내 도움이 필요한 아동, 청소년과 대학생 멘토가 1:1로 매칭되어 진행하는 멘토링 활동입니다. 희망꿈틀멘토링은 기아㈜와 함께 협력합니다. 1.모집대상: 수도권 소재 대학교 재학 또는 거주 중인 대학생으로 12월까지 활동 가능한 자 00명 2.모집기간: ~2025. 3. 7.(금) *모집기간 이후 상시모집 3.활동내용: 학습멘토링(주1~2회 최대 2시간), 정서/진로멘토링, 임직원 멘토링, 연합활동 등 4.활동기간: 2025. 3.~2025. 12. 5.활동장소: 반포종합사회복지관, 지역사회 내 스터디카페 6.활동혜택: 활동비 지급, 기아 임직원과의 만남, 서초구청 수료증 발급, 활동 우수 멘토 선정 7.신청: 구글폼 제출( https://forms.gle/R4dmAqtmuxC1iXyR7 ) 8.문의: 070-7618-6018"
서포터즈,2025 강동종합사회복지관 대학생 서포터즈 모집,강동종합사회복지관,22,정보 없음,2월 17일(월) ~ 3월 16일(일),0,0,https://cf-cpi.campuspick.com/activity/173978066998453.jpg,https://www.campuspick.com/activity/view?id=28014,2025 강동종합사회복지관 대학생 서포터즈 모집  안녕하세요 사회복지법인 기아대책 강동종합사회복지관에서는 지역주민의 행복한 공존을 위한 마중물이 되고자 다양한 지역복지 사업을 진행하고 있습니다.  관련하여 대학생 자원봉사단 모모 서포터즈를 구성하여 지역사회를 위한 다양한 프로그램을 함께 진행하고자 합니다. 관심있는 대학생 분들의 많은 지원 바랍니다.  ■ 활동기간: 2025. 3 ~ 12월 / 월 2회  ■ 활동시간: 매주 금요일 오후  ■ 대외활동 내용 1) 다양한 복지사업 기획 및 진행 2) 후원 모금 활동 3) 영상 촬영·편집 등 기자단 활동 4) 희망하는 다양한 교육 제공 5) 그 외 서포터즈가 희망하는 활동  ■ 모집인원: 총 20명(전공 무관 / 휴학생 가능)  ■ 모집기간: 2025.2.17.(월) ~ 3.16.(일)  ■ 신청방법: 구글폼 신청서 제출(홍보물 내 QR코드 스캔 / https://forms.gle/p8Ng1K9KJeScvbZt9)  ■ 활동헤택: 1) 복지관 서포터즈 위촉 2) 자원봉사활동 시간 인증 3) 활동에 필요한 교육 제공 4) 우수 서포터즈 시상  ■ 문의전화: 02-2041-7800(직통 7811)
서포터즈,?? 영중종합사회복지관 홍보 서포터즈 절찬상'영중' 1기 모집! ??,영중종합사회복지관,12,정보 없음,2월 17일(월) ~ 3월 21일(금),0,0,https://cf-cpi.campuspick.com/activity/1739772363094216.jpg,https://www.campuspick.com/activity/view?id=28008,"?? SNS·영상 제작, 홍보 활동에 관심 있는 청년을 찾습니다! ?? ?? 복지관과 함께 성장하며, 우리 마을을 직접 알리는 특별한 경험을 해보세요!  ?? 절찬상'영중'은? ?? 복지관의 다양한 활동을 직접 알리고, 지역사회와 소통하는 홍보 서포터즈입니다! ?? 카드뉴스, 영상 콘텐츠 제작부터 주민 홍보까지! 다양한 홍보 활동을 직접 기획하고 실행해요! ???  ?? 모집개요 ?? 접수기간: 2025. 2.17.(월) ~ 3.21.(금) ?? 모집인원: 4명 ?? 모집대상: 평일 및 토요일 활동이 가능한 청년 (월 1회 필수 모임 참여) ?? 우대사항: SNS·영상 제작 경험자, 지역사회 활동에 관심 있는 청년  ?? 활동내용 ?? 복지관 홍보 콘텐츠 직접 제작!(SNS, 블로그, 카드뉴스 등) ?? 복지관 행사 및 사업 취재! ?? 월 1회 정기모임 & 지역사회 홍보 활동  ?? 활동혜택 ?? 자원봉사활동 시간 부여 (1365) ?? 사회복지관 홍보 관련 전문 교육 제공 ?? 활동 수료증 발급 & 우수 서포터즈 시상  ?? 신청방법 ?? 구글폼(https://forms.gle/nV7pWBBeWsKQ1dTB6) 작성 후 제출 (QR코드 스캔??) ?? 기관 내방 또는 전화접수 가능  ?? 문의사항 마을협력팀 윤서연 사회복지사 ?? 070-7771-0170"
서포터즈,청년 생명사랑 서포터즈단 모집,울산광역자살예방센터,26,정보 없음,2월 17일(월) ~ 3월 12일(수),0,0,https://cf-cpi.campuspick.com/activity/1739758327650512.jpg,https://www.campuspick.com/activity/view?id=28003,정보 없음
기자단,?? 방송통신위원회가 제16기 국민정책기자단을 모집합니다??,방송통신위원회,293,D-7,2월 4일(화) ~ 2월 28일(금),0,0,https://cf-cpi.campuspick.com/activity/173994618041334.jpg,https://www.campuspick.com/activity/view?id=28048,정보 없음
기자단,서울노인복지센터) 2025 영상서포터즈단 모집,서울노인복지센터,321,D-7,2월 17일(월) ~ 2월 28일(금),0,0,https://cf-cpi.campuspick.com/activity/1739753844927503.jpg,https://www.campuspick.com/activity/view?id=28000,"2025 서울노인복지센터 청년 영상 서포터즈단 모집   1. 모집 대상 - 어르신과 소통하며 영상 제작 실무 경험을 쌓고 싶은 대학생 및 일반인 (휴학생 적극 환영)  2. 모집 분야 1) 탑골미술관 홍보팀 - 활동내용: 탑골미술관 전시 홍보, 전시 관람 어르신 인터뷰 전시 연계 프로그램 스케치 영상 제작 등 * 탑골미술관 자세히 알아보기 https://seoulnoin.or.kr/senior/space2.asp  2) 서울국제노인영화제 홍보팀 - 활동내용: 서울국제노인영화제 홍보, 찾아가는 서울국제노인영화제 스케치 영상 제작 등 * 서울국제노인영화제 자세히 알아보기 https://seoulnoin.or.kr/local/sisff.asp  3) 서울노인복지센터 기관 홍보팀 - 활동내용: 센터 사업 소개 영상, 기획 인터뷰 영상 구상 및 제작 등 * 2024년 기획인터뷰 영상 보기 - https://youtu.be/lWCn7WhUJ3g - https://youtu.be/xfeaie8qCCQ  3. 운영 방식 1) 활동 일정: 주1회 (월4회), 팀별 날짜 지정 후 활동 2) 활동 내용: 팀별 영상 기획 및 촬영, 편집 및 업로드 3) 장비 지원: 촬영 장비 및 편집 프로그램  4. 활동혜택 1) 영상 제작 및 기획 실무 경험 제공 2) 영상 서포터즈단 명찰 제공 3) vms 봉사시간 부여 및 활동 인증서 수여 4) 정기 모임 지원 5) 우수 팀 수상, 수상 경품 제공 6) 자원봉사자 송년모임 초청  5. 신청방법 1) 지원서 및 개인정보활용 동의서 다운로드 후 작성 2) 이전 제작 영상 (포트폴리오) 1~2편과 함께 메일 제출 (is2411@seoulnoin.or.kr)"
